{
  "schemaVersion": 1,
  "datasetVersion": "aster-1.2.0",
  "name": "Aster Research Station",
  "entities": [
    {
      "id": "station",
      "label": "Aster Research Station",
      "kind": "station",
      "aliases": [
        "Aster",
        "the station"
      ],
      "properties": {
        "fictional": "true"
      }
    },
    {
      "id": "team-01",
      "label": "Operations Team",
      "kind": "team",
      "aliases": [
        "Operations"
      ],
      "properties": {
        "fictional": "true"
      }
    },
    {
      "id": "team-02",
      "label": "Ocean Team",
      "kind": "team",
      "aliases": [
        "Ocean"
      ],
      "properties": {
        "fictional": "true"
      }
    },
    {
      "id": "team-03",
      "label": "Atmosphere Team",
      "kind": "team",
      "aliases": [
        "Atmosphere"
      ],
      "properties": {
        "fictional": "true"
      }
    },
    {
      "id": "team-04",
      "label": "Robotics Team",
      "kind": "team",
      "aliases": [
        "Robotics"
      ],
      "properties": {
        "fictional": "true"
      }
    },
    {
      "id": "team-05",
      "label": "Ecology Team",
      "kind": "team",
      "aliases": [
        "Ecology"
      ],
      "properties": {
        "fictional": "true"
      }
    },
    {
      "id": "team-06",
      "label": "Logistics Team",
      "kind": "team",
      "aliases": [
        "Logistics"
      ],
      "properties": {
        "fictional": "true"
      }
    },
    {
      "id": "room-01",
      "label": "Room R-01",
      "kind": "room",
      "aliases": [
        "R-01",
        "reception"
      ],
      "properties": {
        "fictional": "true"
      }
    },
    {
      "id": "room-02",
      "label": "Room R-02",
      "kind": "room",
      "aliases": [
        "R-02"
      ],
      "properties": {
        "fictional": "true"
      }
    },
    {
      "id": "room-03",
      "label": "Room R-03",
      "kind": "room",
      "aliases": [
        "R-03"
      ],
      "properties": {
        "fictional": "true"
      }
    },
    {
      "id": "room-04",
      "label": "Room R-04",
      "kind": "room",
      "aliases": [
        "R-04"
      ],
      "properties": {
        "fictional": "true"
      }
    },
    {
      "id": "room-05",
      "label": "Room R-05",
      "kind": "room",
      "aliases": [
        "R-05"
      ],
      "properties": {
        "fictional": "true"
      }
    },
    {
      "id": "room-06",
      "label": "Room R-06",
      "kind": "room",
      "aliases": [
        "R-06"
      ],
      "properties": {
        "fictional": "true"
      }
    },
    {
      "id": "room-07",
      "label": "Room R-07",
      "kind": "room",
      "aliases": [
        "R-07"
      ],
      "properties": {
        "fictional": "true"
      }
    },
    {
      "id": "room-08",
      "label": "Room R-08",
      "kind": "room",
      "aliases": [
        "R-08"
      ],
      "properties": {
        "fictional": "true"
      }
    },
    {
      "id": "room-09",
      "label": "Room R-09",
      "kind": "room",
      "aliases": [
        "R-09"
      ],
      "properties": {
        "fictional": "true"
      }
    },
    {
      "id": "room-10",
      "label": "Room R-10",
      "kind": "room",
      "aliases": [
        "R-10"
      ],
      "properties": {
        "fictional": "true"
      }
    },
    {
      "id": "room-11",
      "label": "Room R-11",
      "kind": "room",
      "aliases": [
        "R-11"
      ],
      "properties": {
        "fictional": "true"
      }
    },
    {
      "id": "room-12",
      "label": "Room R-12",
      "kind": "room",
      "aliases": [
        "R-12"
      ],
      "properties": {
        "fictional": "true"
      }
    },
    {
      "id": "person-01",
      "label": "Mira Vale",
      "kind": "person",
      "aliases": [
        "Mira"
      ],
      "properties": {
        "fictional": "true"
      }
    },
    {
      "id": "person-02",
      "label": "Elena Ortiz",
      "kind": "person",
      "aliases": [
        "Elena"
      ],
      "properties": {
        "fictional": "true"
      }
    },
    {
      "id": "person-03",
      "label": "Samir Chen",
      "kind": "person",
      "aliases": [
        "Samir"
      ],
      "properties": {
        "fictional": "true"
      }
    },
    {
      "id": "person-04",
      "label": "Tessa Holt",
      "kind": "person",
      "aliases": [
        "Tessa"
      ],
      "properties": {
        "fictional": "true"
      }
    },
    {
      "id": "person-05",
      "label": "Jun Park",
      "kind": "person",
      "aliases": [
        "Jun"
      ],
      "properties": {
        "fictional": "true"
      }
    },
    {
      "id": "person-06",
      "label": "Ada Brooks",
      "kind": "person",
      "aliases": [
        "Ada"
      ],
      "properties": {
        "fictional": "true"
      }
    },
    {
      "id": "person-07",
      "label": "Morgan Reed",
      "kind": "person",
      "aliases": [
        "Morgan"
      ],
      "properties": {
        "fictional": "true"
      }
    },
    {
      "id": "person-08",
      "label": "Morgan Hale",
      "kind": "person",
      "aliases": [
        "Morgan"
      ],
      "properties": {
        "fictional": "true"
      }
    },
    {
      "id": "person-09",
      "label": "Nico Ames",
      "kind": "person",
      "aliases": [
        "Nico"
      ],
      "properties": {
        "fictional": "true"
      }
    },
    {
      "id": "person-10",
      "label": "Lena Shah",
      "kind": "person",
      "aliases": [
        "Lena"
      ],
      "properties": {
        "fictional": "true"
      }
    },
    {
      "id": "person-11",
      "label": "Owen Moss",
      "kind": "person",
      "aliases": [
        "Owen"
      ],
      "properties": {
        "fictional": "true"
      }
    },
    {
      "id": "person-12",
      "label": "Iris Cole",
      "kind": "person",
      "aliases": [
        "Iris"
      ],
      "properties": {
        "fictional": "true"
      }
    },
    {
      "id": "person-13",
      "label": "Theo Lin",
      "kind": "person",
      "aliases": [
        "Theo"
      ],
      "properties": {
        "fictional": "true"
      }
    },
    {
      "id": "person-14",
      "label": "Zara Quinn",
      "kind": "person",
      "aliases": [
        "Zara"
      ],
      "properties": {
        "fictional": "true"
      }
    },
    {
      "id": "person-15",
      "label": "Leo Finch",
      "kind": "person",
      "aliases": [
        "Leo"
      ],
      "properties": {
        "fictional": "true"
      }
    },
    {
      "id": "person-16",
      "label": "Nora West",
      "kind": "person",
      "aliases": [
        "Nora"
      ],
      "properties": {
        "fictional": "true"
      }
    },
    {
      "id": "person-17",
      "label": "Emil Ross",
      "kind": "person",
      "aliases": [
        "Emil"
      ],
      "properties": {
        "fictional": "true"
      }
    },
    {
      "id": "person-18",
      "label": "Sofia Frost",
      "kind": "person",
      "aliases": [
        "Sofia"
      ],
      "properties": {
        "fictional": "true"
      }
    },
    {
      "id": "person-19",
      "label": "Arun Lake",
      "kind": "person",
      "aliases": [
        "Arun"
      ],
      "properties": {
        "fictional": "true"
      }
    },
    {
      "id": "person-20",
      "label": "Maya Stone",
      "kind": "person",
      "aliases": [
        "Maya"
      ],
      "properties": {
        "fictional": "true"
      }
    },
    {
      "id": "person-21",
      "label": "Eli Ward",
      "kind": "person",
      "aliases": [
        "Eli"
      ],
      "properties": {
        "fictional": "true"
      }
    },
    {
      "id": "person-22",
      "label": "Rosa Bell",
      "kind": "person",
      "aliases": [
        "Rosa"
      ],
      "properties": {
        "fictional": "true"
      }
    },
    {
      "id": "person-23",
      "label": "Kai Wells",
      "kind": "person",
      "aliases": [
        "Kai"
      ],
      "properties": {
        "fictional": "true"
      }
    },
    {
      "id": "person-24",
      "label": "Dara Snow",
      "kind": "person",
      "aliases": [
        "Dara"
      ],
      "properties": {
        "fictional": "true"
      }
    },
    {
      "id": "device-01",
      "label": "Oxygen Sensor",
      "kind": "equipment",
      "aliases": [],
      "properties": {
        "fictional": "true"
      }
    },
    {
      "id": "device-02",
      "label": "Water Pump",
      "kind": "equipment",
      "aliases": [],
      "properties": {
        "fictional": "true"
      }
    },
    {
      "id": "device-03",
      "label": "Weather Mast",
      "kind": "equipment",
      "aliases": [],
      "properties": {
        "fictional": "true"
      }
    },
    {
      "id": "device-04",
      "label": "Survey Drone",
      "kind": "equipment",
      "aliases": [],
      "properties": {
        "fictional": "true"
      }
    },
    {
      "id": "device-05",
      "label": "Sample Freezer",
      "kind": "equipment",
      "aliases": [],
      "properties": {
        "fictional": "true"
      }
    },
    {
      "id": "device-06",
      "label": "Backup Radio",
      "kind": "equipment",
      "aliases": [],
      "properties": {
        "fictional": "true"
      }
    },
    {
      "id": "device-07",
      "label": "Air Scrubber",
      "kind": "equipment",
      "aliases": [],
      "properties": {
        "fictional": "true"
      }
    },
    {
      "id": "device-08",
      "label": "Salinity Probe",
      "kind": "equipment",
      "aliases": [],
      "properties": {
        "fictional": "true"
      }
    },
    {
      "id": "device-09",
      "label": "Pressure Gauge",
      "kind": "equipment",
      "aliases": [],
      "properties": {
        "fictional": "true"
      }
    },
    {
      "id": "device-10",